{
  "schema_version": 1,
  "status": "template_blueprint",
  "activation_scope": "child_project_only",
  "last_reconciled_at": null,
  "last_reconciled_ref": null,
  "requirements": [
    {
      "requirement_id": "REQ-83",
      "name": "AI / LLM Evaluation and Model Assurance",
      "applicability": "pending_detection",
      "state": "not_started",
      "reason": null,
      "evidence_refs": [],
      "last_verified_ref": null,
      "last_verified_at": null,
      "blocking_findings": []
    },
    {
      "requirement_id": "REQ-84",
      "name": "User Research, Problem Validation and UX Validation",
      "applicability": "pending_detection",
      "state": "not_started",
      "reason": null,
      "evidence_refs": [],
      "last_verified_ref": null,
      "last_verified_at": null,
      "blocking_findings": []
    },
    {
      "requirement_id": "REQ-85",
      "name": "Product Analytics and Outcome Evidence",
      "applicability": "pending_detection",
      "state": "not_started",
      "reason": null,
      "evidence_refs": [],
      "last_verified_ref": null,
      "last_verified_at": null,
      "blocking_findings": []
    },
    {
      "requirement_id": "REQ-86",
      "name": "Experimentation and Hypothesis Lifecycle",
      "applicability": "optional",
      "state": "not_started",
      "reason": "Activate only when a bounded experiment is justified.",
      "evidence_refs": [],
      "last_verified_ref": null,
      "last_verified_at": null,
      "blocking_findings": []
    },
    {
      "requirement_id": "REQ-87",
      "name": "Progressive Delivery and Feature Safety",
      "applicability": "pending_detection",
      "state": "not_started",
      "reason": null,
      "evidence_refs": [],
      "last_verified_ref": null,
      "last_verified_at": null,
      "blocking_findings": []
    },
    {
      "requirement_id": "REQ-88",
      "name": "AI-Generated Engineering Quality and Maintainability Review",
      "applicability": "applicable",
      "state": "not_started",
      "reason": "Engineering-quality review is part of major module completion/release readiness.",
      "evidence_refs": [],
      "last_verified_ref": null,
      "last_verified_at": null,
      "blocking_findings": []
    }
  ],
  "allowed_applicability": ["pending_detection", "applicable", "not_applicable", "optional"],
  "allowed_states": ["not_started", "in_progress", "blocked", "verification_required", "passed", "failed", "not_applicable"],
  "rules": [
    "A passed state requires project-specific evidence and a verified repository/runtime reference.",
    "not_applicable requires a non-empty project-specific reason.",
    "A blueprint or policy file is never pass evidence.",
    "Blocking findings must be cleared or explicitly risk-accepted through normal authenticated consent before release where policy permits."
  ]
}
